<!ELEMENT receta (nombre, descripcion, ingredientes, instrucciones)>
<!ATTLIST receta xmlns:xsi CDATA #REQUIRED>
<!ATTLIST receta xsi:noNamespaceSchemaLocation CDATA #REQUIRED>
<!ELEMENT nombre (#PCDATA)>
<!ELEMENT descripcion (#PCDATA)>
<!ELEMENT ingredientes (ingrediente+)>
<!ELEMENT ingrediente (item, cantidad)>
<!ELEMENT item (#PCDATA)>
<!ELEMENT cantidad (#PCDATA)>
<!ATTLIST cantidad unidad CDATA #REQUIRED>
<!ELEMENT instrucciones (paso+)>
<!ELEMENT paso (#PCDATA)>
<!ATTLIST paso num CDATA #REQUIRED>
